{
  "$schema": "https://json-schema.org/draft/2020-12/schema",
  "$id": "https://math-flow.local/schemas/run.schema.json",
  "title": "Math Flow Run Manifest",
  "type": "object",
  "required": [
    "protocolVersion",
    "problemId",
    "ledgerHead",
    "runner",
    "baseRun",
    "outputProfile",
    "requestDigests",
    "providerRuns",
    "artifacts"
  ],
  "properties": {
    "protocolVersion": { "const": 1 },
    "runKind": {
      "type": "string",
      "enum": [
        "credit-assignment",
        "judgment",
        "knowledge-build",
        "legacy-projection",
        "research-credit-refresh",
        "research-update",
        "verifier-attestation"
      ]
    },
    "problemId": { "type": "string" },
    "ledgerHead": { "type": "string" },
    "problemLedgerHead": { "type": "string" },
    "problemLedgerDigest": {
      "type": ["string", "null"],
      "pattern": "^sha256:[0-9a-f]{64}$"
    },
    "judgeSpec": {
      "type": "object",
      "required": ["id", "digest"],
      "properties": {
        "id": { "type": "string" },
        "digest": { "type": "string", "pattern": "^sha256:[0-9a-f]{64}$" }
      },
      "additionalProperties": false
    },
    "verifier": {
      "type": "object",
      "required": ["id", "specDigest", "implementation"],
      "properties": {
        "id": { "type": "string" },
        "specDigest": { "type": "string", "pattern": "^sha256:[0-9a-f]{64}$" },
        "implementation": { "type": "string" }
      },
      "additionalProperties": false
    },
    "runner": {
      "type": "object",
      "required": ["implementation", "mathFlowVersion"],
      "properties": {
        "implementation": { "type": "string" },
        "mathFlowVersion": { "type": "string" }
      },
      "additionalProperties": false
    },
    "judgeBuilder": {
      "type": "object",
      "required": ["inputBuilder", "invocationAdapter", "outputAdapter", "reducer"],
      "properties": {
        "inputBuilder": { "type": "string" },
        "invocationAdapter": { "type": "string" },
        "outputAdapter": { "type": "string" },
        "reducer": { "type": ["string", "null"] }
      },
      "additionalProperties": false
    },
    "baseRun": { "type": ["string", "null"] },
    "outputProfile": { "type": "string" },
    "requestDigests": {
      "type": "array",
      "items": { "type": "string", "pattern": "^sha256:[0-9a-f]{64}$" }
    },
    "providerRuns": { "type": "array", "items": { "type": "object" } },
    "inputs": { "type": "object" },
    "artifacts": {
      "type": "array",
      "items": {
        "type": "object",
        "required": ["path", "role", "mediaType", "digest", "bytes"],
        "properties": {
          "path": { "type": "string" },
          "role": { "type": "string" },
          "mediaType": { "type": "string" },
          "digest": { "type": "string", "pattern": "^sha256:[0-9a-f]{64}$" },
          "bytes": { "type": "integer", "minimum": 0 }
        },
        "additionalProperties": false
      }
    }
  },
  "allOf": [
    {
      "if": {
        "required": ["runKind"],
        "properties": { "runKind": { "const": "verifier-attestation" } }
      },
      "then": { "required": ["verifier", "inputs"] },
      "else": { "required": ["judgeSpec", "judgeBuilder"] }
    }
  ],
  "additionalProperties": false
}
