{
  "protocolVersion": 1,
  "problemId": "no-three-in-line-77",
  "ledgerHead": "be5cadd97b2cd4b5916c5cda87838c5e132ec5a2",
  "problemLedgerHead": "87f78eb20d47a1db7d4ef35702bf00b4af94ad8d",
  "problemLedgerDigest": "sha256:7f1b880efd5b9e0d043ddabad88a31b5a25beed435108a6505a337c0b96b00e3",
  "judgeSpec": {
    "id": "openrouter-validity-judgment-v3",
    "digest": "sha256:cf5263db9eafaccb98bca221a921209e8b76ca3c63c410f409bca2751719adf7"
  },
  "runner": {
    "implementation": "openrouter-validity-judgment-v3",
    "mathFlowVersion": "0.6.0"
  },
  "judgeBuilder": {
    "inputBuilder": "claim-evidence-packet-v3",
    "invocationAdapter": "openrouter-chat-completions-v1",
    "outputAdapter": "report-extract-validity-v3",
    "reducer": null
  },
  "baseRun": null,
  "outputProfile": "math-flow/validity-judgment-v3",
  "requestDigests": [
    "sha256:9896f969cda64412bcd404d148c576a315fb6806fd7a75085db434334640124b",
    "sha256:3b1c7784ff9f979384cfaa2a89eb1dca21b236f6b76d7061059ecbbb82225b54"
  ],
  "providerRuns": [
    {
      "provider": "openrouter",
      "stage": "report",
      "requestedModel": "openai/gpt-5.6-sol",
      "resolvedModel": "openai/gpt-5.6-sol",
      "responseId": "gen-1787209729-eWW1l3yDycb0jDaJsV2N",
      "usage": {
        "prompt_tokens": 18295,
        "completion_tokens": 5018,
        "total_tokens": 23313,
        "cost": 0.13244,
        "is_byok": false,
        "prompt_tokens_details": {
          "cached_tokens": 0,
          "cache_write_tokens": 18292,
          "audio_tokens": 0,
          "video_tokens": 0
        },
        "cost_details": {
          "upstream_inference_cost": 0.13244,
          "upstream_inference_prompt_cost": 0.05717,
          "upstream_inference_completions_cost": 0.07527
        },
        "completion_tokens_details": {
          "reasoning_tokens": 4142,
          "image_tokens": 0,
          "audio_tokens": 0
        }
      }
    },
    {
      "provider": "openrouter",
      "stage": "extract",
      "requestedModel": "openai/gpt-5.6-sol",
      "resolvedModel": "openai/gpt-5.6-sol",
      "responseId": "gen-1787209813-Tz4HoBXD0Waicms1IYMl",
      "usage": {
        "prompt_tokens": 2033,
        "completion_tokens": 372,
        "total_tokens": 2405,
        "cost": 0.01193125,
        "is_byok": false,
        "prompt_tokens_details": {
          "cached_tokens": 0,
          "cache_write_tokens": 2030,
          "audio_tokens": 0,
          "video_tokens": 0
        },
        "cost_details": {
          "upstream_inference_cost": 0.01193125,
          "upstream_inference_prompt_cost": 0.00635125,
          "upstream_inference_completions_cost": 0.00558
        },
        "completion_tokens_details": {
          "reasoning_tokens": 0,
          "image_tokens": 0,
          "audio_tokens": 0
        }
      }
    }
  ],
  "runKind": "judgment",
  "inputs": {
    "subjectTransactionIds": [
      "c5e8096d942d57228bb4fed00f7617fb6b43af9f"
    ],
    "declaredReferenceTransactionIds": [],
    "dependencyPacketDigest": "sha256:041d0480a75cdde1bc859eb27eb3bbcc43041cefde1b3dffaa456550ac590a92",
    "objectiveAttestationRunDigest": null,
    "knowledgeContext": null
  },
  "artifacts": [
    {
      "path": "dependency-packet.json",
      "role": "judgment-dependency-packet",
      "mediaType": "application/json",
      "digest": "sha256:3bbe785359521feb055a454de0cd0d62235880b81bff99a56940595463528b99",
      "bytes": 2833
    },
    {
      "path": "judgment.json",
      "role": "judgment-record",
      "mediaType": "application/json",
      "digest": "sha256:704d7bd1396469625579cdfc0cd738fddacd7a9eddd07c18536a2f6ae586830d",
      "bytes": 3758
    },
    {
      "path": "report.md",
      "role": "judgment-report",
      "mediaType": "text/markdown",
      "digest": "sha256:a91861750ad80cca3f08284e302b54bbf1a415434a430c2f1e0030d9f941ea7b",
      "bytes": 3941
    }
  ]
}
