{
  "protocolVersion": 1,
  "runKind": "verifier-attestation",
  "problemId": "schur-number-6",
  "ledgerHead": "b28dd977ae39eb77989de8e60b63f7eacd8982d2",
  "problemLedgerHead": "b28dd977ae39eb77989de8e60b63f7eacd8982d2",
  "problemLedgerDigest": "sha256:3a4e5dc16b2489edc1edb12863ecf765aa1d5a22aa61a7c5c8bda3b13ccfca18",
  "runner": {
    "implementation": "math-flow-oci-attestation-producer-v1",
    "mathFlowVersion": "0.6.0"
  },
  "verifier": {
    "id": "python-stdlib-3-13-v1",
    "specDigest": "sha256:fc7ed06b77396fabc1da84694b4d8a08800843f41ad8ca4b9cd666b67ba60884",
    "implementation": "oci-command-v1"
  },
  "baseRun": null,
  "outputProfile": "math-flow/verifier-attestation-v1",
  "requestDigests": [
    "sha256:c5e24083c93a7ae7dc72c470edf7377b9cf0b70b2828f7cb2a0f2440408fbba3"
  ],
  "providerRuns": [],
  "inputs": {
    "transactionId": "b28dd977ae39eb77989de8e60b63f7eacd8982d2",
    "contributionId": "fredricksen-sweet-536-certificate",
    "verifierSpecDigest": "sha256:fc7ed06b77396fabc1da84694b4d8a08800843f41ad8ca4b9cd666b67ba60884",
    "environmentDigest": "sha256:706bbc3e9afe2e838ceb1436a3246054d028cbdb86b33c8a21f5609584ca1e94"
  },
  "artifacts": [
    {
      "path": "attestation.json",
      "role": "verifier-attestation",
      "mediaType": "application/json",
      "digest": "sha256:141bfe13066b8bc29f2bd0c7f6ec46ca0a9c7fdc890274f661f1d0ced9b0cdc6",
      "bytes": 2726
    },
    {
      "path": "stderr.log",
      "role": "verifier-stderr",
      "mediaType": "application/octet-stream",
      "digest": "sha256:f0acba4a50ab4265563f0b165fabfab1ff30676f561443a1148e2875353e2e3e",
      "bytes": 948
    },
    {
      "path": "stdout.log",
      "role": "verifier-stdout",
      "mediaType": "application/octet-stream",
      "digest": "sha256:6500f91c9a41b35475ef0b72d01c00367fd2d2ee4c08223a23a66bef8c7d4a76",
      "bytes": 123
    }
  ]
}
