{
  "protocolVersion": 1,
  "problemId": "bssc-sum-capacity",
  "ledgerHead": "0ee3fa9ecb9c0d06c9dba7e3318f334360d31375",
  "problemLedgerHead": "dcdd3ab29be1a45b42a75767dbee30d8381544eb",
  "problemLedgerDigest": "sha256:361ab8c751586738730b9a86a3b2eac0196f13be92f6a72929a7714f15bde30f",
  "judgeSpec": {
    "id": "openrouter-validity-judgment-v4",
    "digest": "sha256:d215d9551070236ded41ea38bb8f8403e8a7aa2d47954555907b7aee005212f6"
  },
  "runner": {
    "implementation": "openrouter-validity-judgment-v4",
    "mathFlowVersion": "0.6.0"
  },
  "judgeBuilder": {
    "inputBuilder": "claim-evidence-packet-v4",
    "invocationAdapter": "openrouter-chat-completions-v1",
    "outputAdapter": "report-extract-validity-v4",
    "reducer": null
  },
  "baseRun": null,
  "outputProfile": "math-flow/validity-judgment-v4",
  "requestDigests": [
    "sha256:bd3fa416539f70112a7628187b9c246b390e37c11d46e4f8154cec7e98ef5761",
    "sha256:632b592746f8eca88685e8f88de23cd019f06f5493b262f651caa11dd791a8ff"
  ],
  "providerRuns": [
    {
      "provider": "openrouter",
      "stage": "report",
      "requestedModel": "openai/gpt-5.6-sol",
      "resolvedModel": "openai/gpt-5.6-sol",
      "responseId": "gen-1787216924-AY9itmysmPEoutGKKV2n",
      "usage": {
        "prompt_tokens": 60020,
        "completion_tokens": 7366,
        "total_tokens": 67386,
        "cost": 0.12550175,
        "is_byok": false,
        "prompt_tokens_details": {
          "cached_tokens": 60017,
          "cache_write_tokens": 0,
          "audio_tokens": 0,
          "video_tokens": 0
        },
        "cost_details": {
          "upstream_inference_cost": 0.12550175,
          "upstream_inference_prompt_cost": 0.01501175,
          "upstream_inference_completions_cost": 0.11049
        },
        "completion_tokens_details": {
          "reasoning_tokens": 5653,
          "image_tokens": 0,
          "audio_tokens": 0
        }
      }
    },
    {
      "provider": "openrouter",
      "stage": "extract",
      "requestedModel": "openai/gpt-5.6-sol",
      "resolvedModel": "openai/gpt-5.6-sol",
      "responseId": "gen-1787217043-Pyaf9EKIQ5kb8nAQgdv4",
      "usage": {
        "prompt_tokens": 2719,
        "completion_tokens": 893,
        "total_tokens": 3612,
        "cost": 0.02189,
        "is_byok": false,
        "prompt_tokens_details": {
          "cached_tokens": 0,
          "cache_write_tokens": 2716,
          "audio_tokens": 0,
          "video_tokens": 0
        },
        "cost_details": {
          "upstream_inference_cost": 0.02189,
          "upstream_inference_prompt_cost": 0.008495,
          "upstream_inference_completions_cost": 0.013395
        },
        "completion_tokens_details": {
          "reasoning_tokens": 72,
          "image_tokens": 0,
          "audio_tokens": 0
        }
      }
    }
  ],
  "runKind": "judgment",
  "inputs": {
    "subjectTransactionIds": [
      "7e7626cbff7270572d51a8fda719154ab602907f"
    ],
    "declaredReferenceTransactionIds": [],
    "dependencyPacketDigest": "sha256:92ded020a92178750aa2a0f1219aedeebf4575414adffa5b9b199656d6afd116",
    "objectiveAttestationRunDigestsByTransactionId": {},
    "knowledgeContext": null
  },
  "artifacts": [
    {
      "path": "dependency-packet.json",
      "role": "judgment-dependency-packet",
      "mediaType": "application/json",
      "digest": "sha256:6d2a04a1edfff13f2823a50963fd186d31b8fc9d9ab190bbd7e010fd12a4c074",
      "bytes": 2291
    },
    {
      "path": "judgment.json",
      "role": "judgment-record",
      "mediaType": "application/json",
      "digest": "sha256:420c70298055e20e9058e54fc115ebc5df1409abfc1d1d96e5c5dfeec48c1ff2",
      "bytes": 6307
    },
    {
      "path": "report.md",
      "role": "judgment-report",
      "mediaType": "text/markdown",
      "digest": "sha256:9b520c18227ee3214cd872527eeda078549c895d5d7aa544072dd523b1f47b34",
      "bytes": 7572
    }
  ]
}
