{
  "protocolVersion": 1,
  "problemId": "bssc-sum-capacity",
  "ledgerHead": "dcdd3ab29be1a45b42a75767dbee30d8381544eb",
  "problemLedgerHead": "dcdd3ab29be1a45b42a75767dbee30d8381544eb",
  "problemLedgerDigest": "sha256:361ab8c751586738730b9a86a3b2eac0196f13be92f6a72929a7714f15bde30f",
  "judgeSpec": {
    "id": "openrouter-hierarchical-research-builder-v2",
    "digest": "sha256:feb31a7c5139add91f8584916d8a5e3039d1b754c3b2938355fdab40c6bb4afb"
  },
  "runner": {
    "implementation": "openrouter-hierarchical-research-builder-v2",
    "mathFlowVersion": "0.6.0"
  },
  "judgeBuilder": {
    "inputBuilder": "accepted-validity-batch-program-state-v2",
    "invocationAdapter": "openrouter-chat-completions-v1",
    "outputAdapter": "structured-research-batch-v2",
    "reducer": "batched-research-state-v2"
  },
  "baseRun": "sha256:72236a92d2e2b3422cea7a5bdbac99894efa1e6ec4797ef70013025f8dd37ede",
  "outputProfile": "math-flow/hierarchical-research-v2",
  "requestDigests": [],
  "providerRuns": [],
  "runKind": "knowledge-build",
  "inputs": {
    "conflictIds": [],
    "builderSpecDigest": "sha256:feb31a7c5139add91f8584916d8a5e3039d1b754c3b2938355fdab40c6bb4afb",
    "schemaVersion": 1,
    "judgmentSetDigest": "sha256:2ca34b8b739c6ef061616479e8b205f3593baf16511a92879d430e223edd1cd3",
    "baseStateRun": "sha256:72236a92d2e2b3422cea7a5bdbac99894efa1e6ec4797ef70013025f8dd37ede",
    "problemId": "bssc-sum-capacity",
    "projectionSpecDigest": "sha256:aff0a59fbcbce48dfae50bb7210aaec760c3757039fcd98977bfe40e9f09cabf",
    "laneId": "sha256:95b03c0c1c1160b881e2bb7085a0b97dc4ad29bf108a1daf13ee7d3149e1cdd1",
    "judgmentIds": [
      "sha256:903cd80e2b171a3a8966983414210ce3950b959a2a3c8f38583005077f9f3203"
    ],
    "buildToken": "sha256:5b75326dace07e22544df82bdd7b3514f0bbd4834e2e85f2423d7584efbd0542"
  },
  "artifacts": [
    {
      "path": "control/build-input.json",
      "role": "knowledge-build-input",
      "mediaType": "application/json",
      "digest": "sha256:3082752fe66a53ba76602fa3aeddd5c9df0ab684c260403f360a3509536b6096",
      "bytes": 752
    },
    {
      "path": "input/research-batch.json",
      "role": "research-batch-input",
      "mediaType": "application/json",
      "digest": "sha256:ab698f530588e8dc812b2cf2891cd6a525291c4d439e6238fe3f5dbc88639c18",
      "bytes": 3045
    },
    {
      "path": "state/delta.json",
      "role": "research-program-delta",
      "mediaType": "application/json",
      "digest": "sha256:7e52faed0ac172a0b6aba3656923e7232fc23c045149d1f45b2aa4b7cf63ad35",
      "bytes": 68
    },
    {
      "path": "state/state.json",
      "role": "research-program-state",
      "mediaType": "application/json",
      "digest": "sha256:84fee05180095e4e088a154183bba2641406fcdd400a3f9e3085c3a1da2f5b9a",
      "bytes": 20836
    }
  ]
}
