{
  "protocolVersion": 1,
  "runKind": "verifier-attestation",
  "problemId": "bssc-sum-capacity",
  "ledgerHead": "14889884ae6ac1f80cc56485e7acf1b0b2cb6ae9",
  "problemLedgerHead": "14889884ae6ac1f80cc56485e7acf1b0b2cb6ae9",
  "problemLedgerDigest": "sha256:f0b5a93ab08839f1d61f37b6147654bdf17b207e10612d5612aeb18f8a1327b5",
  "runner": {
    "implementation": "math-flow-oci-attestation-producer-v1",
    "mathFlowVersion": "0.6.0"
  },
  "verifier": {
    "id": "python-stdlib-3-13-v1",
    "specDigest": "sha256:fc7ed06b77396fabc1da84694b4d8a08800843f41ad8ca4b9cd666b67ba60884",
    "implementation": "oci-command-v1"
  },
  "baseRun": null,
  "outputProfile": "math-flow/verifier-attestation-v1",
  "requestDigests": [
    "sha256:acacb5fe70f1b998f12f0743a0c3d374817e404961b1c4a67fcdb96b0423c1ff"
  ],
  "providerRuns": [],
  "inputs": {
    "transactionId": "14889884ae6ac1f80cc56485e7acf1b0b2cb6ae9",
    "contributionId": "uv-relaxed-converse-tensorization",
    "verifierSpecDigest": "sha256:fc7ed06b77396fabc1da84694b4d8a08800843f41ad8ca4b9cd666b67ba60884",
    "environmentDigest": "sha256:706bbc3e9afe2e838ceb1436a3246054d028cbdb86b33c8a21f5609584ca1e94"
  },
  "artifacts": [
    {
      "path": "attestation.json",
      "role": "verifier-attestation",
      "mediaType": "application/json",
      "digest": "sha256:8a1fa315f864da5311dd63421c1d22051940bc3e448a4e6b74f2d3d00a743d56",
      "bytes": 2531
    },
    {
      "path": "stderr.log",
      "role": "verifier-stderr",
      "mediaType": "application/octet-stream",
      "digest": "sha256:3791645c869c075e3bb4a2fe531bfca27d34fefc58689df7ca16f150c3ec3616",
      "bytes": 926
    },
    {
      "path": "stdout.log",
      "role": "verifier-stdout",
      "mediaType": "application/octet-stream",
      "digest": "sha256:f45017fe78e32e55970371dc9b2f3f634b69b07364741ffe2478ccc6d48aa9e9",
      "bytes": 177
    }
  ]
}
