{
  "protocolVersion": 1,
  "problemId": "schur-number-6",
  "ledgerHead": "6a72758caaeb34a56d8d55653c8a3184ffbbe65e",
  "problemLedgerHead": "6a72758caaeb34a56d8d55653c8a3184ffbbe65e",
  "problemLedgerDigest": "sha256:c9188dbe0372874de247898e909429615e6a30cb4275786aaeac4012f53a0f12",
  "judgeSpec": {
    "id": "openrouter-research-program-builder-v2",
    "digest": "sha256:53a245fb9fd50b1dc218998e43806a6e479bbdea6a38253125bfb56775b5ad7c"
  },
  "runner": {
    "implementation": "openrouter-knowledge-builder-v2",
    "mathFlowVersion": "0.6.0"
  },
  "judgeBuilder": {
    "inputBuilder": "judgment-batch-v1",
    "invocationAdapter": "openrouter-chat-completions-v1",
    "outputAdapter": "select-form-extract-knowledge-revisions-v2",
    "reducer": "hierarchical-knowledge-revisions-v3"
  },
  "baseRun": "sha256:84e487224d927148fdcb7a41b8e1a00b27bf221ff0412a294434a2e4d2d46ca3",
  "outputProfile": "math-flow/knowledge-build-markdown-v2",
  "requestDigests": [
    "sha256:e66a664ed300323d34988dabf266472d0d7b0cd772bb728d3127056ac6962417",
    "sha256:f0bd767288b7ce1fe12e2e5bd18750448890e65dcdd85ccdf249a3d02cc11166",
    "sha256:b21e58cff4b9a8fb9a47e0fc45cc09fbe39445bc18284ba6796d39bfc5b1c09b"
  ],
  "providerRuns": [
    {
      "provider": "openrouter",
      "stage": "select",
      "requestedModel": "openai/gpt-5.6-sol",
      "resolvedModel": "openai/gpt-5.6-sol",
      "responseId": "gen-1786669035-h42UmiU1H3wr2Mawmuul",
      "usage": {
        "prompt_tokens": 4583,
        "completion_tokens": 1331,
        "total_tokens": 5914,
        "cost": 0.06857,
        "is_byok": false,
        "prompt_tokens_details": {
          "cached_tokens": 0,
          "cache_write_tokens": 4580,
          "audio_tokens": 0,
          "video_tokens": 0
        },
        "cost_details": {
          "upstream_inference_cost": 0.06857,
          "upstream_inference_prompt_cost": 0.02864,
          "upstream_inference_completions_cost": 0.03993
        },
        "completion_tokens_details": {
          "reasoning_tokens": 1113,
          "image_tokens": 0,
          "audio_tokens": 0
        }
      },
      "cacheHit": false
    },
    {
      "provider": "openrouter",
      "stage": "report",
      "requestedModel": "openai/gpt-5.6-sol",
      "resolvedModel": "openai/gpt-5.6-sol",
      "responseId": "gen-1786669059-IDzUqMyTT71fvNj3Rnbo",
      "usage": {
        "prompt_tokens": 16268,
        "completion_tokens": 10000,
        "total_tokens": 26268,
        "cost": 0.40167125,
        "is_byok": false,
        "prompt_tokens_details": {
          "cached_tokens": 0,
          "cache_write_tokens": 16265,
          "audio_tokens": 0,
          "video_tokens": 0
        },
        "cost_details": {
          "upstream_inference_cost": 0.40167125,
          "upstream_inference_prompt_cost": 0.10167125,
          "upstream_inference_completions_cost": 0.3
        },
        "completion_tokens_details": {
          "reasoning_tokens": 1691,
          "image_tokens": 0,
          "audio_tokens": 0
        }
      },
      "cacheHit": false
    },
    {
      "provider": "openrouter",
      "stage": "extract",
      "requestedModel": "openai/gpt-5.6-sol",
      "resolvedModel": "openai/gpt-5.6-sol",
      "responseId": "gen-1786669199-BeAYFoi6gEnEtDGquxrt",
      "usage": {
        "prompt_tokens": 21039,
        "completion_tokens": 6664,
        "total_tokens": 27703,
        "cost": 0.33141,
        "is_byok": false,
        "prompt_tokens_details": {
          "cached_tokens": 0,
          "cache_write_tokens": 21036,
          "audio_tokens": 0,
          "video_tokens": 0
        },
        "cost_details": {
          "upstream_inference_cost": 0.33141,
          "upstream_inference_prompt_cost": 0.13149,
          "upstream_inference_completions_cost": 0.19992
        },
        "completion_tokens_details": {
          "reasoning_tokens": 2588,
          "image_tokens": 0,
          "audio_tokens": 0
        }
      },
      "cacheHit": false
    }
  ],
  "runKind": "knowledge-build",
  "inputs": {
    "baseStateRun": "sha256:84e487224d927148fdcb7a41b8e1a00b27bf221ff0412a294434a2e4d2d46ca3",
    "judgmentSetDigest": "sha256:6afa318698e77445948f0fd96eb00accdf61c902a517cd4868fb3cdb19b8be78",
    "laneId": "sha256:d86b7e9d80b73c89558f57ed3f72232ba0514d3eeb1c386985c31f760f2ed288",
    "builderSpecDigest": "sha256:53a245fb9fd50b1dc218998e43806a6e479bbdea6a38253125bfb56775b5ad7c",
    "judgmentIds": [
      "sha256:f8d51a0852eb5c904f4ced22e6c60aeededf65f464dbafd0855503b96739a8e1"
    ],
    "projectionSpecDigest": "sha256:eb2e997ae1f7ee8a619c0c7cd0362f696ab6c70682ffb12a856407a43684abd3",
    "schemaVersion": 1,
    "conflictIds": [],
    "problemId": "schur-number-6",
    "buildToken": "sha256:728e28e42dffca14e03b1e335e05dc65781a3e61960737c4b59ce639251d8a55"
  },
  "artifacts": [
    {
      "path": "control/build-input.json",
      "role": "knowledge-build-input",
      "mediaType": "application/json",
      "digest": "sha256:99d0352f96060e52687be5f0595fba1a124a600e99b836abb61eb60a8d084159",
      "bytes": 749
    },
    {
      "path": "control/normalizations.json",
      "role": "adapter-normalizations",
      "mediaType": "application/json",
      "digest": "sha256:0d03e8e3724380c5a64368bbb4b692cd6e8484876735026abdaee55733b8d5c9",
      "bytes": 27
    },
    {
      "path": "control/selection.json",
      "role": "node-selection",
      "mediaType": "application/json",
      "digest": "sha256:3a4112e3a3757dc6fbc96fbdabeceed12ae1bf672500ebfc9379e89575ae305d",
      "bytes": 1044
    },
    {
      "path": "report.md",
      "role": "report",
      "mediaType": "text/markdown",
      "digest": "sha256:1023ef81a25128f9f8bbf27f2b85674baa273fb4d0f5c074e76229ed3fef6734",
      "bytes": 30640
    },
    {
      "path": "state/delta.json",
      "role": "knowledge-delta",
      "mediaType": "application/json",
      "digest": "sha256:94e2afd7a2a9d1e859b8ebd3ab8c50dd83127c7a65393ca265f4699428571038",
      "bytes": 15122
    },
    {
      "path": "state/revisions.jsonl",
      "role": "knowledge-revisions",
      "mediaType": "application/x-ndjson",
      "digest": "sha256:d9d87241efdba4cca2f35a816af93038068ef3c180b73269bda4b9ad2f534f3e",
      "bytes": 42260
    },
    {
      "path": "state/state.json",
      "role": "knowledge-state",
      "mediaType": "application/json",
      "digest": "sha256:527ede2ee44b85fbe64aa6ace1b8072dfcfaf9f272a1618807174956af17dd35",
      "bytes": 56626
    }
  ]
}
