{
  "protocolVersion": 1,
  "problemId": "bssc-sum-capacity",
  "ledgerHead": "f236017c62c67ce4218c1f81ea34134f0954b556",
  "problemLedgerHead": "f236017c62c67ce4218c1f81ea34134f0954b556",
  "problemLedgerDigest": "sha256:c09072335d25b15b56d9c6d7db078168c5a0bf40eb84ccfd5b6655221c19b4bc",
  "judgeSpec": {
    "id": "openrouter-hierarchical-research-builder-v6",
    "digest": "sha256:04bfe92aebb7c144d4f969cc7a744781212069a32b62258cd00744ff95531e30"
  },
  "runner": {
    "implementation": "openrouter-hierarchical-research-builder-v6",
    "mathFlowVersion": "0.6.0"
  },
  "judgeBuilder": {
    "inputBuilder": "accepted-validity-submission-program-state-v6",
    "invocationAdapter": "openrouter-chat-completions-v1",
    "outputAdapter": "structured-research-submission-v6",
    "reducer": "sequential-research-state-v6"
  },
  "baseRun": "sha256:63fbbf8d8a2a7af46f2c343dae1e5bc7fc6e9ceab8cd4588548d61b448f8ac2b",
  "outputProfile": "math-flow/hierarchical-research-v6",
  "requestDigests": [
    "sha256:38366744590fba4e0e205e87646efb73e53d02fd3e1452459b3e56e8ad086675",
    "sha256:87156a4b1421b1a4cac146cfcc84de8d1f178b44263e1d6c0f020e70c1fe3862"
  ],
  "providerRuns": [
    {
      "schemaVersion": 1,
      "stage": "organize",
      "judgeSpec": {
        "id": "openrouter-hierarchical-research-builder-v6",
        "digest": "sha256:04bfe92aebb7c144d4f969cc7a744781212069a32b62258cd00744ff95531e30"
      },
      "transport": {
        "implementation": "openrouter-chat-completions-v1",
        "endpoint": "https://openrouter.ai/api/v1/chat/completions",
        "digest": "sha256:0b5ef303cbe83668ce8dfb9fe6c5dec811a949794a2a8b177a8262431e4cba59"
      },
      "modelIdentity": {
        "requestedModel": "openai/gpt-5.6-sol",
        "resolvedModel": "openai/gpt-5.6-sol",
        "judgeSpecDigest": "sha256:04bfe92aebb7c144d4f969cc7a744781212069a32b62258cd00744ff95531e30",
        "transportDigest": "sha256:0b5ef303cbe83668ce8dfb9fe6c5dec811a949794a2a8b177a8262431e4cba59",
        "digest": "sha256:e4600febed127c2286aaf53e739cc530ed4c8f01256e273b9eb1b3331102ce49"
      },
      "requestDigest": "sha256:87156a4b1421b1a4cac146cfcc84de8d1f178b44263e1d6c0f020e70c1fe3862",
      "responseDigest": "sha256:52c4c54212da5352b81dacbc133355b401b77e278beee4fa815836a65643dc3c",
      "attempts": 2,
      "attemptRecords": [
        {
          "attempt": 1,
          "requestDigest": "sha256:38366744590fba4e0e205e87646efb73e53d02fd3e1452459b3e56e8ad086675",
          "outcome": "validation-rejected",
          "errorSummary": "research item v2 root/uv-scalar-converse/correlated-input-envelope-factorization has missing program: root/uv-scalar-converse",
          "errorDigest": "sha256:beccaefaff6a1b3e175fa3bb57fe9ca259823033410b9cebae7ae513e32225ed",
          "responseDigest": "sha256:55679d9e4575f6d8b00c64d64ec708f0a2cef05f497b2a525cb461477f5396eb",
          "providerResponseId": "gen-1787770407-GvwD190GbEZpMCDpfcOh",
          "feedbackDigest": "sha256:f33992652482b875ebc391c36508b815ce04dde89c3a3367a9d26e36dce250ee"
        },
        {
          "attempt": 2,
          "requestDigest": "sha256:87156a4b1421b1a4cac146cfcc84de8d1f178b44263e1d6c0f020e70c1fe3862",
          "responseDigest": "sha256:52c4c54212da5352b81dacbc133355b401b77e278beee4fa815836a65643dc3c",
          "outcome": "accepted",
          "providerResponseId": "gen-1787770491-3yeqF9732gl55bzJcas4"
        }
      ],
      "attemptJournalDigest": "sha256:0bc37a53d0e55cd65b8bebfd970024131d2cc69cf9f886b9f4defa190c9948a1",
      "providerResponseId": "gen-1787770491-3yeqF9732gl55bzJcas4",
      "invocationDigest": "sha256:526490146d0aa95268b1ff730c46025a28b38389145b50e2949bc092daaac26e"
    }
  ],
  "runKind": "knowledge-build",
  "inputs": {
    "projectionSpecDigest": "sha256:8bcab1fa785b4c5d757668ef2ff9ce1ef3046a54828c71ed846f84e6b33cf31a",
    "judgmentSetDigest": "sha256:dea4947c3f7fae77d8eb73990fa56329c6ebe25bff270b803a6d8491ea9857e9",
    "judgmentIds": [
      "sha256:2c29fd881dec9aa923aa0713acc56df2c05d02f30ac544213f720af9158b7a41"
    ],
    "schemaVersion": 1,
    "laneId": "sha256:ec815411bee6bd8c4779c5353c584e3302c684ec8229b3a6acc087d3841a5bdc",
    "builderSpecDigest": "sha256:04bfe92aebb7c144d4f969cc7a744781212069a32b62258cd00744ff95531e30",
    "problemId": "bssc-sum-capacity",
    "baseStateRun": "sha256:63fbbf8d8a2a7af46f2c343dae1e5bc7fc6e9ceab8cd4588548d61b448f8ac2b",
    "conflictIds": [],
    "buildToken": "sha256:54dedb407215b89947d9242c36ce71c674893f35a666c86e64f4fba1c525de49",
    "judgmentRunDigest": "sha256:5ad78e67ec6a1f83651aa590ff7f3c2fb809eac8201422a69cd2bc8783a475c9",
    "submissionInputDigest": "sha256:0b642bf3e78fd5fc0a92dabfb8fce32febbe1c27eaf84848b4251fb078ad120d"
  },
  "artifacts": [
    {
      "path": "control/build-input.json",
      "role": "knowledge-build-input",
      "mediaType": "application/json",
      "digest": "sha256:a3e7b4e2f5934c0aab3428ccfc5a9a2260d390f9ca3be5caad72f746e52f3183",
      "bytes": 752
    },
    {
      "path": "input/evidence-manifest.json",
      "role": "submission-evidence-manifest",
      "mediaType": "application/json",
      "digest": "sha256:6d1000d3d2d1a278b749db500b983e4d8bc9e7e6902dcde33aabdbb3da5d2e5a",
      "bytes": 2889
    },
    {
      "path": "input/submission.json",
      "role": "research-builder-submission-input",
      "mediaType": "application/json",
      "digest": "sha256:5a98b241a3f0c51174ffefcbe910dad8db18fa553ca0fbaff4d12cb0d7ff0e78",
      "bytes": 2928
    },
    {
      "path": "state/base-state.json",
      "role": "research-program-base-state",
      "mediaType": "application/json",
      "digest": "sha256:84db705fa76c3f18f2fae79ce0c00c816527570debea753a4c83fcab35ddd1d3",
      "bytes": 10377
    },
    {
      "path": "state/same-world-handoff.json",
      "role": "research-builder-handoff",
      "mediaType": "application/json",
      "digest": "sha256:c7bee72b40fef00eb4de7b77f87438c05bb3a286ca1f2a5239e989cee3b55e1b",
      "bytes": 753
    },
    {
      "path": "state/state.json",
      "role": "research-program-state",
      "mediaType": "application/json",
      "digest": "sha256:ce08f9b1d7d259d0190cd6a02f3eee52be0d18e94c7169626fa1de8053828de0",
      "bytes": 21464
    },
    {
      "path": "state/topology-alignment.json",
      "role": "research-topology-alignment",
      "mediaType": "application/json",
      "digest": "sha256:f959bda48a90b62e8cba31294c06e3aeb90dd2ac0c8e40ba228f9b77150b33f0",
      "bytes": 6071
    },
    {
      "path": "state/transition.json",
      "role": "research-program-transition",
      "mediaType": "application/json",
      "digest": "sha256:d594426170ff8c5c00367990d9f5d662cc7615aa0f049198e0214a344241a464",
      "bytes": 11663
    }
  ]
}
