{
  "protocolVersion": 1,
  "problemId": "no-three-in-line-77",
  "ledgerHead": "a8b2ad5a0840c1d37abccaaba9e3b0cd42352b73",
  "problemLedgerHead": "0ffe9a12c3ad44cf136dd22df7083dcdd53af1b0",
  "problemLedgerDigest": "sha256:19f6c665fde2bc17b138f06566def8a8901d35b2f952061f4ddcfdb95b04b2bc",
  "judgeSpec": {
    "id": "openrouter-research-program-builder-v3",
    "digest": "sha256:8dbfc0666d364444fd0e237c4465a6bdca502d6eb06318f2b8a9bfb99d001d8f"
  },
  "runner": {
    "implementation": "openrouter-knowledge-builder-v3",
    "mathFlowVersion": "0.6.0"
  },
  "judgeBuilder": {
    "inputBuilder": "judgment-batch-v1",
    "invocationAdapter": "openrouter-chat-completions-v1",
    "outputAdapter": "select-form-extract-knowledge-revisions-v2",
    "reducer": "hierarchical-knowledge-revisions-v3"
  },
  "baseRun": "sha256:b7e475a8294350280405bbe9b667cd3dcc0c306b815eb9cdfe3922f14dc9abd7",
  "outputProfile": "math-flow/knowledge-build-markdown-v2",
  "requestDigests": [
    "sha256:45a903780a940ce33116be98fa37278e9d5d36207509d8845ce3b06978bd351c",
    "sha256:3d2ac7e48225461ba3a6aeeb8ba311680dc98651ad37aa369b832358190828c2",
    "sha256:c920d3872a0daa4d6b7868198868b6807720b74f7fe2c7f32fb4d3c2991ec6a4"
  ],
  "providerRuns": [
    {
      "provider": "openrouter",
      "stage": "select",
      "requestedModel": "openai/gpt-5.6-sol",
      "resolvedModel": "openai/gpt-5.6-sol",
      "responseId": "gen-1786663046-qoO92gkShnYH2CsgGoMe",
      "usage": {
        "prompt_tokens": 6525,
        "completion_tokens": 1234,
        "total_tokens": 7759,
        "cost": 0.040296,
        "is_byok": false,
        "prompt_tokens_details": {
          "cached_tokens": 6522,
          "cache_write_tokens": 0,
          "audio_tokens": 0,
          "video_tokens": 0
        },
        "cost_details": {
          "upstream_inference_cost": 0.040296,
          "upstream_inference_prompt_cost": 0.003276,
          "upstream_inference_completions_cost": 0.03702
        },
        "completion_tokens_details": {
          "reasoning_tokens": 1034,
          "image_tokens": 0,
          "audio_tokens": 0
        }
      },
      "cacheHit": false
    },
    {
      "provider": "openrouter",
      "stage": "report",
      "requestedModel": "openai/gpt-5.6-sol",
      "resolvedModel": "openai/gpt-5.6-sol",
      "responseId": "gen-1786663076-0hqET0Jyr1KwYU1h81gn",
      "usage": {
        "prompt_tokens": 12500,
        "completion_tokens": 9245,
        "total_tokens": 21745,
        "cost": 0.35547125,
        "is_byok": false,
        "prompt_tokens_details": {
          "cached_tokens": 0,
          "cache_write_tokens": 12497,
          "audio_tokens": 0,
          "video_tokens": 0
        },
        "cost_details": {
          "upstream_inference_cost": 0.35547125,
          "upstream_inference_prompt_cost": 0.07812125,
          "upstream_inference_completions_cost": 0.27735
        },
        "completion_tokens_details": {
          "reasoning_tokens": 1513,
          "image_tokens": 0,
          "audio_tokens": 0
        }
      },
      "cacheHit": false
    },
    {
      "provider": "openrouter",
      "stage": "extract",
      "requestedModel": "openai/gpt-5.6-sol",
      "resolvedModel": "openai/gpt-5.6-sol",
      "responseId": "gen-1786663196-AvI98lP7xKelhc5ZEyPt",
      "usage": {
        "prompt_tokens": 16462,
        "completion_tokens": 5749,
        "total_tokens": 22211,
        "cost": 0.27535375,
        "is_byok": false,
        "prompt_tokens_details": {
          "cached_tokens": 0,
          "cache_write_tokens": 16459,
          "audio_tokens": 0,
          "video_tokens": 0
        },
        "cost_details": {
          "upstream_inference_cost": 0.27535375,
          "upstream_inference_prompt_cost": 0.10288375,
          "upstream_inference_completions_cost": 0.17247
        },
        "completion_tokens_details": {
          "reasoning_tokens": 1034,
          "image_tokens": 0,
          "audio_tokens": 0
        }
      },
      "cacheHit": false
    }
  ],
  "runKind": "knowledge-build",
  "inputs": {
    "problemId": "no-three-in-line-77",
    "schemaVersion": 1,
    "conflictIds": [],
    "projectionSpecDigest": "sha256:17286f418e1335fd718c1c7f7a87d04863bae14de496efd790d3ea6bc4b6cee9",
    "judgmentSetDigest": "sha256:f030a7b89cf7ef60299386f1dd83a363a16c80b71fde2d76ff2ce40c130119d5",
    "builderSpecDigest": "sha256:8dbfc0666d364444fd0e237c4465a6bdca502d6eb06318f2b8a9bfb99d001d8f",
    "judgmentIds": [
      "sha256:d24a70c16a08ff85401e969cfe12d8f8253056bb8d75e469ec226eba7a3b44c5"
    ],
    "laneId": "sha256:c2eccc232f4dc66ce6e6802682bcf0ff027c762023d7048689156d8bcc3b8742",
    "baseStateRun": "sha256:b7e475a8294350280405bbe9b667cd3dcc0c306b815eb9cdfe3922f14dc9abd7",
    "buildToken": "sha256:ee290d36e38358c2faba317da9475f4eabb9757742ededadc2c67ffd17927374"
  },
  "artifacts": [
    {
      "path": "control/build-input.json",
      "role": "knowledge-build-input",
      "mediaType": "application/json",
      "digest": "sha256:3b41e23289a4645e29181a2fa5cf1e790168bde7bbc53a1699006181af8a57c0",
      "bytes": 754
    },
    {
      "path": "control/normalizations.json",
      "role": "adapter-normalizations",
      "mediaType": "application/json",
      "digest": "sha256:0d03e8e3724380c5a64368bbb4b692cd6e8484876735026abdaee55733b8d5c9",
      "bytes": 27
    },
    {
      "path": "control/selection.json",
      "role": "node-selection",
      "mediaType": "application/json",
      "digest": "sha256:c83ef36e695dc4552aa8a9638ef7c2a4964954dc84cd69d0cf062d18cf1c4cbf",
      "bytes": 958
    },
    {
      "path": "report.md",
      "role": "report",
      "mediaType": "text/markdown",
      "digest": "sha256:596bccf9d165d80a63581b324aacee7380012f7d5262e08ad8978e7efd062132",
      "bytes": 31139
    },
    {
      "path": "state/delta.json",
      "role": "knowledge-delta",
      "mediaType": "application/json",
      "digest": "sha256:ea6b0455bf6f9e0ec7c659c99b429de425e1c954625a4b3320dd97cbad7a5544",
      "bytes": 18293
    },
    {
      "path": "state/revisions.jsonl",
      "role": "knowledge-revisions",
      "mediaType": "application/x-ndjson",
      "digest": "sha256:cc37fb7422528efefc019caa03caf747f8cb676b79f40289fddb90693077ed7b",
      "bytes": 69438
    },
    {
      "path": "state/state.json",
      "role": "knowledge-state",
      "mediaType": "application/json",
      "digest": "sha256:b8e9e1b84205e397efa4c0159f44c8e872b82587ee47626a660d3f36c94e79d0",
      "bytes": 105792
    }
  ]
}
