{
  "protocolVersion": 1,
  "problemId": "no-three-in-line-77",
  "ledgerHead": "17928a941d7503ff0dc32740b707f475728300a3",
  "problemLedgerHead": "17928a941d7503ff0dc32740b707f475728300a3",
  "problemLedgerDigest": "sha256:621d2dfa7452294f9698c71e4f086eca0f0d77f6c1314b7c08450465092d519a",
  "judgeSpec": {
    "id": "openrouter-hierarchical-research-builder-v3",
    "digest": "sha256:7a860e24060549b877c06136df7e8b66e558be29363c873983debaa8381c9d96"
  },
  "runner": {
    "implementation": "openrouter-hierarchical-research-builder-v3",
    "mathFlowVersion": "0.6.0"
  },
  "judgeBuilder": {
    "inputBuilder": "accepted-validity-batch-program-state-v3",
    "invocationAdapter": "openrouter-chat-completions-v1",
    "outputAdapter": "structured-research-batch-v3",
    "reducer": "batched-research-state-v3"
  },
  "baseRun": "sha256:22fc355587cda3ddd986172321c17755ed74e7b0c73b0662bd3a3324e6eafc8b",
  "outputProfile": "math-flow/hierarchical-research-v3",
  "requestDigests": [
    "sha256:dbf7b90a47c0ad8c158d99d625a00452ba1e773ce13481a1eedebea96497c698"
  ],
  "providerRuns": [
    {
      "provider": "openrouter",
      "stage": "organize",
      "requestedModel": "openai/gpt-5.6-sol",
      "resolvedModel": "openai/gpt-5.6-sol",
      "responseId": "gen-1787211844-FF4NtTUb61kqb6P9BAka",
      "usage": {
        "prompt_tokens": 24442,
        "completion_tokens": 2113,
        "total_tokens": 26555,
        "cost": 0.108074375,
        "is_byok": false,
        "prompt_tokens_details": {
          "cached_tokens": 0,
          "cache_write_tokens": 24439,
          "audio_tokens": 0,
          "video_tokens": 0
        },
        "cost_details": {
          "upstream_inference_cost": 0.108074375,
          "upstream_inference_prompt_cost": 0.076379375,
          "upstream_inference_completions_cost": 0.031695
        },
        "completion_tokens_details": {
          "reasoning_tokens": 903,
          "image_tokens": 0,
          "audio_tokens": 0
        }
      }
    }
  ],
  "runKind": "knowledge-build",
  "inputs": {
    "baseStateRun": "sha256:22fc355587cda3ddd986172321c17755ed74e7b0c73b0662bd3a3324e6eafc8b",
    "problemId": "no-three-in-line-77",
    "judgmentSetDigest": "sha256:48f372f26aaea36aa2aa427b279975c9b2282f17b20157592928923901bf6de1",
    "laneId": "sha256:612c18e947136d4db68bebd4706ea225727d3ec8d65670a6ac83df3a84f6e07c",
    "conflictIds": [],
    "projectionSpecDigest": "sha256:df3a8d053a3734d1027930d2188dcd9a4caeb8a57f0317ca46b6c72bfc8bae5e",
    "schemaVersion": 1,
    "judgmentIds": [
      "sha256:5f3c9f8ea2a70b0a588d1b6eee0d715693c15fb9d1eb7b2c8409b34eac67fba6"
    ],
    "builderSpecDigest": "sha256:7a860e24060549b877c06136df7e8b66e558be29363c873983debaa8381c9d96",
    "buildToken": "sha256:6c135f1d2eef3099ddd5ed7278b9277de9174ff8564fb4e1e2ea71fadcda5ad2"
  },
  "artifacts": [
    {
      "path": "control/build-input.json",
      "role": "knowledge-build-input",
      "mediaType": "application/json",
      "digest": "sha256:0c9456b19d912ba90daf0b36fd4cac84230130a71cc05838f8370558c08d5eef",
      "bytes": 754
    },
    {
      "path": "input/research-batch.json",
      "role": "research-batch-input",
      "mediaType": "application/json",
      "digest": "sha256:3b4b8461a79cb53b05d277366171daaaac88be827ff081a378cdbff54f192ab6",
      "bytes": 608
    },
    {
      "path": "state/delta.json",
      "role": "research-program-delta",
      "mediaType": "application/json",
      "digest": "sha256:92e1320cf370c6f4969ad72a19b42cc1560b6c3bb1281e742059a7c91d15a39b",
      "bytes": 4717
    },
    {
      "path": "state/state.json",
      "role": "research-program-state",
      "mediaType": "application/json",
      "digest": "sha256:908e2951e49c2344889f690edf27a6f3fe42eace88964baa61eed0eb58554909",
      "bytes": 21634
    }
  ]
}
